Item,Price,Description
"Pastry Assortment","12","Chef’s choice of three baked goods; dine-in only"
"Daily Quiche","10","Ask about seasonal special"
"Smashed Avocado Tartine","13.5","Avocado, cherry tomatoes, rainbow beets, pickled onions, herbs, lemon, pumpkin seeds, sea salt, chili flakes on sourdough"
"Make Your Own Omelette","14","Open-faced omelette; choose 3: roasted tomatoes, roasted red peppers, herbed feta, gruyère, pickled onions; topped with balsamic mixed greens"
"Farmhouse Granola Parfait","10","Greek yogurt, almond-butter granola, winter berry marmalade"
"Overnight Oats","11","Vanilla toasted oats, coconut, banana, chia; banana chips, candied pumpkin seeds, toasted coconut"
"Fiona's Berries & Cream Belgian Waffles","15","With vanilla bean crème fraîche, winter berry marmalade, fresh berries; maple syrup"
"Papa’s Breakfast Bowl","16","Roasted potatoes, arugula, bacon, caramelized onions, avocado, chipotle aioli, sunny egg"
"Caitlin's Breakfast Wrap","15","Scrambled eggs, gruyère, candied bacon, arugula, pickled onions, roasted tomatoes; chipotle aioli"
"Estee's Bacon Egg & Cheese","12.5","Candied bacon, over-easy egg, cheddar, spicy tomato ketchup on croissant bun"
"Maman’s Breakfast Sandwich","14","Sunny egg, candied bacon, avocado, roasted tomatoes, caramelized onions on brioche"
"Charlotte's Sunrise Spread","16","GF pancake topped with candied bacon, avocado, two sunny eggs; maple syrup"
"Eggs Ratatouille (weekends)","16","Eggplant, zucchini, stewed tomatoes baked with two sunny eggs; herbed feta; toasted sourdough"
"Evan's Soupe du Jardin","12","Roasted carrots, coconut milk, herbs, ginger, turmeric; sage oil; candied pumpkin seeds; croutons"
"Raquel's Chicken Caesar Salad","16","Romaine hearts, roasted chicken, shaved parmesan, croutons, pickled onions; caesar on side"
"Elisa's Mediterranean Harvest Bowl","16","Chickpeas, roasted sweet potatoes, hummus, roasted tomatoes, cucumber, herbed feta, EVOO, toasted bread, sunny egg"
"Wilde Smoked Salmon Salad","18","Smoked salmon, hash-brown croutons, mixed greens, cucumber, herbed yogurt, avocado"
"Camille’s Spinach & Beet Salad","16","Spinach, roasted beets, honeycrisp apples, herbed feta, pickled onions, herbed apple-cider vinaigrette, pomegranate seeds"
"Maribel’s Quinoa & Chickpea Bowl","16","Tri-color quinoa, romaine, chickpeas, roasted sweet potatoes, roasted carrots, candied pumpkin seeds; lemon-sumac tahini"
"Martha Stewart’s Chicken Club Sandwich","17","Roasted chicken, candied bacon, sharp cheddar, romaine, pickled onions, avocado, sweet & spicy mustard on triple-decker bread"
"Martine's Mediterranean Steak Sandwich","17","Marinated flank steak, za’atar tahini, roasted red peppers, pickled onions, grated tomato, arugula, chimichurri on baguette"
"Ham & Cheese Croissant Sandwich","12","Dijon mustard, cornichon"
"Andrea’s Everything Croissant & Salmon Sandwich","17","Smoked salmon, lemon whipped cream cheese, everything seasoning, cucumber, pickled onions, herbs on everything croissant bun"
"Croque Maman","16","Parisian ham, gruyère, house béchamel on country bread"
"Chloe's Garden Wrap","15","Hummus, roasted beets, spinach, herbed feta, pickled onions, chimichurri, marinated chickpeas in GF tortilla"
"Katie's Chicken Sandwich","17","Roasted chicken, roasted red peppers & tomatoes, basil aioli, arugula on baguette"
"Marie's Chicken Caesar Wrap","16","Roasted chicken, romaine, shaved parmesan, pickled onions, caesar in GF tortilla"
"Martha Stewart’s Pecan Streusel Cake","5.5","Sour cream coffee cake with cinnamon pecan streusel and glaze"
"Martha Stewart’s Kitchen Sink Cookie","5","Dark chocolate, coconut, sour cherries, apricots, toasted pecans"
"Martha Stewart’s Chewy Chocolate Gingerbread Cookie","5","Ginger, cinnamon, cloves, nutmeg, molasses, chocolate chunks"
"Martha Stewart’s Lemon Crème Brûlée Sugar Bun","7","Croissant bun with lemon-vanilla cream, caramelized top"
"Martha Stewart’s Golden Potato Gratin Tart","11","Yukon gold potatoes, gruyère, comté, béchamel, roasted garlic, red onions, dijon, rosemary"
"Old-Fashioned Apple Turnover","6","Puff pastry, slow-roasted apples, cinnamon, cardamom, crunchy sugar"
"Double Chocolate Croissant Cube","6","Chocolate croissant dough with chocolate cream, torched meringue, cookie crumble"
"Cranberry & Blood Orange Croissant Swirl","6","Croissant swirl with cranberry–blood orange jam and white-chocolate glaze"
"Speculoos Spice Cookie","4.5","Cinnamon, cardamom, ginger, nutmeg, cloves, allspice"
"Vegan Sesame Tahini Dark Chocolate Cookie","4.5","Sesame and dark chocolate chunks"
"Vegan Pumpkin Spice Carrot Cake","5","Carrot cake with warm spices; topped with pumpkin seeds"
"Croissant","4","Classic butter croissant"
"Vegan Croissant","4.5","Plant-based croissant"
"Everything Croissant","4.75","Croissant with everything seasoning"
"Pain au Chocolat","4","Chocolate croissant"
"Almond Croissant","5","Frangipane-filled; sliced almonds, powdered sugar"
"Chocolate Almond Croissant","5","Frangipane and dark chocolate; sliced almonds"
"Pistachio Chocolate Croissant","5.5","White-chocolate pistachio ganache, dark chocolate, crushed pistachios"
"Kouign Maman","6","Caramelized layered pastry"
"Cinnamon Bun Kouign Maman","6.5","Kouign-amann with cinnamon-bun twist"
"Nutella Beignet","6","Fried brioche stuffed and topped with Nutella"
"Nutty Chocolate Chip Cookie","4.5","Macadamias, almonds, walnuts, dark chocolate wafers"
"Classic Chocolate Chip Cookie","4.5","Nut-free chocolate chip cookie"
"Chocolate Sandwich Cookie","3.5","White-chocolate ganache between chocolate wafers"
"Nutella Brownie","4.5","Fudgy chocolate-hazelnut brownie with salted caramel and chocolate pearls"
"Banana Chocolate Walnut Bread","4.5","Banana bread with spices, dark chocolate, walnuts"
"Pistachio Orange Cake","5.5","Orange-scented tea cake with pistachio paste and glaze"
"Thyme Blueberry Goat Cheese Scone","4.75","Blueberry jam, thyme, goat cheese scone"
"Cheddar Scallion Scone","4.75","Savory scone with cheddar, scallions, hot honey"
"Martha Stewart’s Pomegranate Punch","8","Pomegranate & blood orange juice, ginger syrup, sparkling water, mint, pomegranate seeds"
"Hazelnut Latte (House-made)","6.25/7.25","Latte with candied hazelnut bits; hot or iced"
"Fleur de Sel Caramel Latte","6.5/7.5","House caramel latte; hot or iced"
"Chocolate Milk Matcha Latte","7.25/8.25","Chocolate milk + matcha; mint cocoa whipped cream, cacao nibs; hot or iced"
"Drip Coffee","3/4","House brew"
"Espresso","3.5","Double shot"
"Americano","3.5/4.75","Double or triple with hot water"
"Macchiato","4","Double with a dollop of steamed milk"
"Cortado","4","Double espresso with equal parts steamed milk"
"Cappuccino","4.75","Double espresso with foamed milk"
"Flat White","4.75","Double espresso with steamed milk"
"Latte","5.25/6.5","Double or triple with steamed milk"
"Salted Tahini Honeycomb Latte","6.25/7.25","Espresso, tahini-honey sauce, milk; sesame crumbs"
"Honey Lavender Latte","6/7.25","Espresso with honey-lavender syrup; hot or iced"
"Mocha","5.75/7","Espresso with cocoa and steamed milk"
"Hot Chocolate","5.5/6.5","Classic hot chocolate"
"Kid's Hot Chocolate","4","Lukewarm hot chocolate"
"Lavender Hot Chocolate","6.25/7.25","Hot chocolate with lavender"
"Chai Latte","6/6.5","Dona chai with steamed milk; hot or iced"
"Matcha Latte","6/7","Matcha with steamed almond milk; hot or iced"
"Hot Tea","4.25","Selection of Sloane teas"
"Iced Tea","4/4.5","Crimson berry, peach mango green, or black citron"
"Iced Coffee","4.25/5.25","Flash brewed over ice"
"Cold Brew","4.75/5.75","Slow-steeped cold brew over ice"
"Fresh Orange Juice","6/7","Fresh-squeezed"
"Fresh Grapefruit Juice","6/7","Fresh-squeezed"
"Alain Milliat Juice","6","Seasonal selections"
"BKE Kombucha","8","Seasonal selections"
"Belvoir","3.5","Seasonal selections"
"Grilled Cheese","6","On country bread"
"Maman’s Scramble","6","Two eggs with choice of comté, roasted tomato, or roasted red pepper"
"Papa’s Potatoes","6","Roasted potatoes"
"AB&C","7","Almond butter and seasonal fruit compote on toasted country bread"
